{
  "schema_version": "experience_v1_2_to_v2_0_bridge_v1",
  "bridge_id": "experience_v1_2_to_v2_0_center_bridge",
  "status": "center_bridge_only",
  "runtime_effect": "none",
  "dionysus_intake": {
    "note_ref": "seed_staging/future/seed_aoa_experience_wave0_v1_2_to_v2_0_intake_pack.md",
    "map_ref": "seed_staging/future/seed_aoa_experience_wave0_v1_2_to_v2_0_intake_pack.map.yaml",
    "status": "staged_only_not_landed",
    "source_count": 9,
    "claim_limit": "archive_readable_not_owner_ready"
  },
  "source_seeds": [
    "aoa-experience-service-mesh-operations-seed-v1_2.zip",
    "aoa-experience-office-foundry-role-pairs-seed-v1_3.zip",
    "aoa-experience-agonic-pair-trials-mechanical-arena-kernel-seed-v1_4.zip",
    "aoa-experience-epistemic-duel-model-of-other-forge-seed-v1_5.zip",
    "aoa-experience-epistemic-memory-rank-reputation-engine-seed-v1_6.zip",
    "aoa-experience-affective-economy-honor-treasury-seed-v1_7.zip",
    "aoa-experience-context-routing-nervous-system-seed-v1_8.zip",
    "aoa-experience-context-memory-weaving-continuity-loom-seed-v1_9.zip",
    "aoa-experience-living-workspace-continuity-runtime-seed-v2_0.zip"
  ],
  "predecessor_surfaces": [
    "Dionysus:seed_staging/future/seed_aoa_experience_wave0_v1_2_to_v2_0_intake_pack.md",
    "Dionysus:seed_staging/future/seed_aoa_experience_wave0_v1_2_to_v2_0_intake_pack.map.yaml",
    "docs/EXPERIENCE_WAVE1_KERNEL.md",
    "docs/EXPERIENCE_WAVE2_CERTIFICATION_WATCHTOWER.md",
    "docs/EXPERIENCE_WAVE3_FEDERATION_ADOPTION.md",
    "docs/EXPERIENCE_WAVE4_POLIS_CONSTITUTION.md",
    "docs/EXPERIENCE_WAVE5_SOVEREIGN_OFFICE.md",
    "docs/EXPERIENCE_AGON_SERVICE_SEAM_V1_1.md",
    "docs/EXPERIENCE_RUNTIME_AUTHORITY_BOUNDARY.md",
    "docs/AGON_PRE_PROTOCOL_STOP_LINES.md",
    "docs/AGON_LAWFUL_MOVE_LANGUAGE.md",
    "docs/AGON_MOVE_OWNER_BINDING.md",
    "docs/AGON_TRIAL_PLAYBOOK_HANDOFF.md",
    "docs/AGON_SEALED_COMMIT_MODEL.md",
    "docs/AGON_MODEL_OF_OTHER_LAW.md",
    "docs/AGON_RETENTION_RANK_ECONOMY.md"
  ],
  "campaign_route": [
    {
      "order": 1,
      "kind": "dionysus_intake",
      "owner": "Dionysus",
      "effect": "source lineage and compost only",
      "stop_lines": [
        "not owner doctrine",
        "not runtime authority"
      ]
    },
    {
      "order": 2,
      "kind": "center_bridge",
      "owner": "Agents-of-Abyss",
      "effect": "center route and stop-line bridge only",
      "stop_lines": [
        "not a live protocol",
        "not owner-local planting"
      ]
    },
    {
      "order": 3,
      "kind": "service_mesh_operations",
      "source_version": "v1.2",
      "owner": "Agents-of-Abyss",
      "effect": "future owner request for service operation boundaries",
      "stop_lines": [
        "no live services",
        "no release authority"
      ]
    },
    {
      "order": 4,
      "kind": "office_foundry_role_pairs",
      "source_version": "v1.3",
      "owner": "aoa-agents",
      "effect": "future role-pair and office posture request",
      "stop_lines": [
        "no assistant self-release",
        "no assistant contestant drift"
      ]
    },
    {
      "order": 5,
      "kind": "mechanical_arena_kernel",
      "source_version": "v1.4",
      "owner": "Agents-of-Abyss",
      "effect": "future Agon arena boundary request",
      "stop_lines": [
        "no live arena",
        "no verdict authority"
      ]
    },
    {
      "order": 6,
      "kind": "epistemic_duel_model_of_other",
      "source_version": "v1.5",
      "owner": "Agents-of-Abyss",
      "effect": "future duel and model-of-other law request",
      "stop_lines": [
        "no judge authority",
        "no model-of-other canon shortcut"
      ]
    },
    {
      "order": 7,
      "kind": "rank_reputation_engine",
      "source_version": "v1.6",
      "owner": "Agents-of-Abyss",
      "effect": "future rank and reputation boundary request",
      "stop_lines": [
        "no rank mutation",
        "no scar write"
      ]
    },
    {
      "order": 8,
      "kind": "affective_honor_treasury",
      "source_version": "v1.7",
      "owner": "Agents-of-Abyss",
      "effect": "future honor and affect boundary request",
      "stop_lines": [
        "no honor mutation",
        "no affective authority over rights"
      ]
    },
    {
      "order": 9,
      "kind": "context_routing_nervous_system",
      "source_version": "v1.8",
      "owner": "aoa-routing",
      "effect": "future advisory routing request",
      "stop_lines": [
        "routing is not owner",
        "no hidden dispatch authority"
      ]
    },
    {
      "order": 10,
      "kind": "continuity_loom",
      "source_version": "v1.9",
      "owner": "aoa-memo",
      "effect": "future recall and continuity gate request",
      "stop_lines": [
        "memo is not truth",
        "no durable memory write without gate"
      ]
    },
    {
      "order": 11,
      "kind": "living_workspace_continuity_runtime",
      "source_version": "v2.0",
      "owner": "8Dionysus",
      "effect": "future workspace continuity projection request",
      "stop_lines": [
        "no .codex/continuity install",
        "no scheduler or runtime worker"
      ]
    },
    {
      "order": 12,
      "kind": "cross_repo_hardening",
      "owner": "aoa-evals",
      "effect": "future proof and regression hardening request",
      "stop_lines": [
        "evals are not authority",
        "drill result is not live verdict"
      ]
    },
    {
      "order": 13,
      "kind": "dionysus_harvest_closure",
      "owner": "Dionysus",
      "effect": "future staging harvest trace after owner outcomes",
      "stop_lines": [
        "no retroactive owner doctrine",
        "no archive replay"
      ]
    }
  ],
  "authority": {
    "bridge_effect": "center_route_only",
    "codex_may": [
      "record source order",
      "map owner requests",
      "bind stop-lines",
      "run validators",
      "prepare future owner-local pull requests after separate gates"
    ],
    "codex_must_not": [
      "create a new aoa-experience repository",
      "copy raw archive proposals into owner truth",
      "open a live arena",
      "grant live summon authority",
      "grant live verdict authority",
      "write scars",
      "mutate rank reputation trust or honor",
      "schedule retention checks",
      "approve release certification or continuity",
      "install .codex/continuity",
      "activate services ports schedulers workers or daemons",
      "write directly to Tree-of-Sophia"
    ],
    "assistant_must_not": [
      "become contestant",
      "become judge",
      "become closer",
      "become summoner",
      "become scar writer",
      "self-release",
      "self-enroll",
      "self-certify"
    ],
    "derived_layers_must_not": [
      "stats_as_proof",
      "memo_as_truth",
      "routing_as_owner",
      "kag_as_canon",
      "sdk_as_authority",
      "dionysus_as_runtime"
    ],
    "human_gates_required": [
      "owner-local planting approval",
      "public-share sanitation review",
      "runtime-owner gate before any service or worker",
      "Tree-of-Sophia review before canon or interpretive intake"
    ]
  },
  "owner_split": [
    {
      "repo": "Dionysus",
      "owns": "source lineage staged intake compost route discipline and later harvest trace",
      "must_not": "become runtime or owner doctrine"
    },
    {
      "repo": "Agents-of-Abyss",
      "owns": "center bridge stop-lines predecessor law mapping and future request order",
      "must_not": "replace owner-local repository truth"
    },
    {
      "repo": "aoa-agents",
      "owns": "role posture assistant service agonic actor boundaries no-hybrid law and office embodiment",
      "must_not": "grant assistant contestant judge closer summoner or self-release authority"
    },
    {
      "repo": "aoa-evals",
      "owns": "proof bundles bounded verdict checks trial integrity and regression checks",
      "must_not": "become live verdict or release authority"
    },
    {
      "repo": "aoa-playbooks",
      "owns": "rehearsal choreography recurring scenario routes and trial composition",
      "must_not": "become runtime ledger or owner doctrine"
    },
    {
      "repo": "aoa-memo",
      "owns": "memory readiness recall retention gates lineage hygiene and writeback boundaries",
      "must_not": "make memory truth without explicit gate"
    },
    {
      "repo": "aoa-stats",
      "owns": "derived observability",
      "must_not": "become proof authority"
    },
    {
      "repo": "aoa-routing",
      "owns": "advisory dispatch salience hints context route receipts and drift watch signals",
      "must_not": "become owner authority"
    },
    {
      "repo": "aoa-sdk",
      "owns": "typed helper contracts and control-plane seams",
      "must_not": "become semantic authority"
    },
    {
      "repo": "aoa-kag",
      "owns": "derived dossiers and pattern candidates",
      "must_not": "become canon or Tree-of-Sophia promotion authority"
    },
    {
      "repo": "aoa-skills",
      "owns": "bounded execution workflows extracted from owner-accepted patterns",
      "must_not": "grant owner doctrine"
    },
    {
      "repo": "aoa-techniques",
      "owns": "reusable engineering practice extracted from owner-accepted patterns",
      "must_not": "grant runtime or canon authority"
    },
    {
      "repo": "8Dionysus",
      "owns": "shared-root projection law where workspace projection surfaces are affected",
      "must_not": "absorb layer source truth"
    },
    {
      "repo": "abyss-stack",
      "owns": "runtime deployment storage and worker substrate after a separate runtime-owner gate",
      "must_not": "activate runtime from this bridge"
    },
    {
      "repo": "Tree-of-Sophia",
      "owns": "source-first canon and interpretive intake through its own review path",
      "must_not": "receive direct writes from this bridge"
    }
  ]
}
